'cname','ctext'$
K dvojznačnosti mezi větou podmínkovou nebo časovou a větou předmětnou může dojít pouze tehdy, stojí-li věta vedlejší za větou hlavní. Stojí-li před větou hlavní, má pouze funkci adverbiální, srov. <I>when he comes I will tell</I> you řeknu vám, až přijde – <I>I will tell you when he comes</I> (1) řeknu vám, až přijde (věta příslovečná); (2) řeknu vám, kdy chodí (přichází) (věta předmětná).
</note>
<note id="8.82.21/P65">
Po slovesech <I>hope</I> doufat, <I>suppose</I>, <I>assume</I> předpokládat apod. se v předmětné větě užívá k odkazování na budoucnost též prézentu, např. <I>I hope they send a wire</I> doufám, že pošlou telegram, <I>suppose the mystery is never solved</I> co když se ta záhada nikdy nevyřeší?
</note>
(e) Předbudoucí čas zahrnuje budoucnost předcházející před pozdější dobou budoucí. Má tedy do jisté míry stejnou funkci jako plusquamperfektum. Vyskytuje se zpravidla s nějakým časovým určením nebo časovou větou. S časovým určením typu <I>how long</I> má význam inkluzivní, tj. vyjadřuje děj, který začal před uvedenou dobou a trvá až do ní, např. <I>next year we shall have been married for twenty years</I> příští rok to bude od naší svatby už dvacet let. Jinak vyjadřuje děj, který před příslušnou dobou skončil, např. <I>Shall we wait for Charles? – No, let’s have tea now, he’ll have had it</I> (<I>when he comes</I>)<I>.</I> Počkáme na Karla? – Ne, nasvačme se nyní, on už bude po svačině (až přijde). <I>Even by the time he reaches the infant school the child will have developed some attitudes.</I> (Mackay 226) Už na počátku školní docházky má dítě vyvinuté některé postoje.
(f) Kromě referenčních významů, tj. odkazování na některou časovou sféru, mají anglické časy též význam relační, tj. vyjadřují vzájemné časové vztahy mezi jednotlivými časy: předčasnost, současnost a následnost. Pouze relační temporální systém se uplatňuje u neurčitých tvarů slovesných (viz 8.85).
Anglický relační systém určitých tvarů se zásadně liší podle toho, zda jsou děje orientovány k přítomnosti nebo k minulosti. Při orientaci k přítomnosti si jednotlivé věty uchovávají svůj základní časový odkaz. Při orientaci k minulosti jsou vyloučeny časy orientované k přítomnosti (prézens, perfektum a futurum) a vyskytují se pouze časy orientované k minulosti, préteritum a plusquamperfektum. Préteritem se vyjadřují děje současné, plusquamperfektem děje předčasné a následnost se vyjadřuje prostředky vyjadřování futura, formálně posunutými do minulosti. Z formálního hlediska představuje relační systém orientovaný k minulosti posunuté formy u všech časů, jak jednoduchých, tak složených, a to tak, že se určitý prézentní tvar všude mění v příslušný čas préteritální.
V češtině se relační temporální systém orientovaný k minulosti v podstatě neliší od relačního temporálního systému orientovaného k přítomnosti. V obou případech se současnost v zásadě vyjadřuje prézentem, předčasnost časem minulým a následnost časem budoucím (není-li možno pro následnost v minulosti užít futura, užívá se podobných opisných vazeb jako v angličtině).
Srovnej <I>We all realize that the task that we have undertaken</I> (předcházející děj minulý) <I>is very exacting</I> (současný děj přítomný) <I>and will require a great deal of effort</I> (následný děj budoucí)<I>.</I> Všichni si uvědomujeme, že úkol, který jsme vzali na sebe, je velmi náročný a bude vyžadovat mnoho úsilí. – <I>We all realized that the task that we had undertaken was very exacting and would require a great deal of effort</I>. Všichni jsme si uvědomili, že úkol, který jsme vzali na sebe, je velmi náročný a bude vyžadovat mnoho úsilí.
K vyjadřování následnosti v minulosti se užívá preteritálního tvaru všech prostředků vyjadřovní futura kromě prostého prézentu, např. <I>The date fixed for the attempt was November 5th, the date on which Parliament was going to be opened. On that day, the King, the Lords and the Commons would all be present.</I> Datum určené pro atentát byl 5. listopad, kdy měl být zahájen Parlament. Toho dne měli být přítomni král a všichni členové Horní a Dolní sněmovny. <I>I caught him in the hall. He was on the point of leaving / He was about to leave.</I> Chytil jsem ho na chodbě, byl právě na odchodu. V knižním jazyce se následný děj v minulosti vyjadřuje vyjadřuje též pomocí <I>be</I> a infinitivu, např. <I>that was his first meeting with the famous inventor whose even more favous successor he was to become</I> to bylo jeho první setkání se slavným vynálezcem, jehož ještě slavnějším nástupcem se měl stát.
V plusquamperfektu se reflektuje nejen perfektum, nýbrž i préterirum, srov. <I>I’m sure that I have put / that I put the key back in the drawer</I> jsem si jist, že jsem klíč dal zpátky do zásuvky – <I>I was sure that I had put the key back in the drawer</I> byl jsem si jist, že jsem klíč dal zpátky do zásuvky.
Vzájemné vztahy mezi ději často vyplývají z pouhého řazení dějů, významu spojek či časových určení, např. <I>he knocked at the door, but there was no answer: he knocked again and entered</I> zaklepal, ale nic se neozvalo; zaklepal podruhé a vstoupil (posloupnost dějů); <I>she made me a cup of tea while I waited</I> uvařila mi šálek čaje, zatímco jsem čekal (děje současné); <I>we had tea when we came home</I> svačili jsme, když jsme přišli domů (první děj následuje po druhém); <I>we had tea before we left</I> svačili jsme, než jsme šli (prvním děj předchází před druhým).
Podrobněji o časových vztacích v závislých větách viz 16.21.7.'$
'8.82.22','Průběhové tvary vyjadřují dočasný děj nebo proces v jeho průběhu (děj nebo proces aktuálně probíhající). Mluvčí jimi děj aktualizuje, soustřeďuje svou i posluchačovu pozornost na průběh děje. Proto je průběhovost zejména u dějů minulých a budoucích do jisté míry záležitost subjektivního pojetí mluvčího.
Průběhový tvar obvykle vyjadřuje jednotlivý případ děje, může však jít i o děj opakovaný. Význam průběhových tvarů je slučitelný zpravidla jen se slovesy dynamickými, nedynamická slovesa průběhovou konjugaci většinou netvoří.
Základní časový odkaz je u průběhových tvarů stejný jako u příslušných tvarů prostých (průběhový prézens odkazuje na přítomnost, průběhové préteritum na určitou minulost atd., viz 8.82.21), je však rozdíl v míře určitosti, specifičnosti. Význam prostých tvarů je obecnější, proto kromě atemporálního užití vyžadují více kontextu, kdežto průběhové tvary se v důsledku svého specifičtějšího významu mohou vyskytovat samy o sobě. Např. <I>What’s happening?</I> (Co se děje?), <I>I’ve been reading</I> (četl jsem) jsou úplné promluvy, kdežto <I>what happens? I have read</I> nikoliv, je třeba dodat nějaký kontext, např. <I>what happens in a case like that</I> (co se stane v takovém případě), <I>I’ve just read your note</I> právě jsem si přečetl váš vzkaz apod.
(a) Průběhový prézens označuje jednotlivý případ děje omezeného trvání, který aktuálně probíhá v bezprostřední či déletrvající přítomnosti (z hlediska doby promluvy), např. <I>Are you trying to make me angry?</I> (Adams 98) Snažíš se mě rozzlobit? <I>I believe you are already recovering</I>. (Adams 109) Myslím, že se už zotavuješ. <I>She is expecting a baby.</I> (Greene 118) Čeká dítě. <I>Your son is turning into a drunkard.</I> (Shaffer 237) Z tvého syna se stává opilec.
Závaznost užití průběhového tvaru k vyjádření tohoto významu závisí na sémantice slovesa a kontextu. Průběhový tvar se zpravidla vyskytuje u sloves vyjadřujících pozorovatelnou činnost nebo děj (viz 8.72), a to jak s podměty životnými, tak i neživotnými, srov. <I>at what speed are we flying?</I> jakou rychlostí letíme?, <I>our bus is coming</I> přijíždí nám autobus, <I>the kettle for tea is boiling</I> voda na čaj se vaří, <I>my nose is running</I> teče mi voda z nosu (mám velkou rýmu), <I>your teeth are chattering</I> cvakají ti zuby, <I>you are trembling</I> vy se třesete, <I>what’s going on here?</I> co se tu děje?
<note id="8.82.22/P66">
U neživotných podmětů se někdy setkáváme s prostým prézentem, např. <I>What’s wrong with the switch? It doesn’t work.</I> Co je s vypínačem? Nefunguje. S životným podmětem je průběhový tvar závaznější, srov. <I>Am I disturbing you? – No, I’m not working.</I> Vyrušuji vás? – Ne, nepracuji. Podobně <I>what goes on</I> vedle <I>what’s going on</I> (zde však jde o frazeologismus). Případy jako <I>the pail leaks</I> (vědro teče), <I>the tap drips</I> (kohoutek kape) vedle <I>the pail is leaking</I>, <I>the tap is dripping</I> odkazují i při odkazování na bezprostřední přítomnost charakteristický rys.
</note>
Srovnej prostý prézens ve větách označujících děje obecně platné, opakované, charakteristické apod.: <I>these planes fly at the speed of sixty hundred miles per hour</I> tato letadla létají rychlostí 600 mil za hodinu, <I>water boils at 100 ºC</I> voda se vaří při 100 ºC.
Průběhový tvar se dále užívá u sloves vyjadřujících činnost nebo proces, které se rozvíjejí, nebo změnu stavu (viz 8.72), např. <I>his work is improving</I> jeho práce se zlepšuje, <I>it’s getting late</I> připozdívá se, <I>dusk is falling</I> padá soumrak, šeří se, <I>the standard of living is rising</I> životní úroveň stoupá, <I>production is growing</I> výroba se zvyšuje apod.
Podobně u jiných sloves dynamické povahy, např. <I>you’re wasting your time</I> maříte čas, <I>they are infringing our rights</I> zasahují nám do našich práv, <I>am I interrupting</I>/<I>disturbing you?</I> vyrušuji vás? <I>am I detaining</I>/<I>keeping you?</I> zdržuji vás? aj.
Nedynamická slovesa tento význam zpravidla vyjadřují prostým prézentem, např. <I>do you recognize that man over there?</I> poznáváte támhle toho člověka? <I>We appreciate your help</I> oceňujeme vaši pomoc, <I>what I want doesn’t matter</I> nezáleží na tom, co chci aj. (viz 8.72). Srovnej prostý a průběhový prézens u nedynamického a dynamického slovesa, která odkazují na tutéž událost: <I>Do you notice it’s raining harder than ever?</I> (Adams 92) Pozoruješ, že prší čím dál víc?
Někdy se setkáváme s průběhovými tvary i u sloves nedynamických, zpravidla v souvislosti s rekategorizací v slovesa akční, která může být spojena se změnou významu.
U sloves smyslového vnímání je prostý tvar pravidlem při významu „vnímat příslušným smyslem“, např. <I>I see nothing suitable</I> nevidím nic vhodného, <I>I smell coffee</I> cítím kávu apod., popř. se užívá <I>can</I> ( viz 8.44.11): <I>I can smell coffee.</I> Průběhový tvar je v tomto významu řídký, např. <I>I am actually hearing his voice</I>. Opravdu slyším jeho hlas. Výjimku tvoří kontexty vyjadřující postupnou změnu (přibývání/ubývání, zlepšování/zhoršování apod.), v nichž se průběhový tvar zdá být pravidlem pro všechna slovesa: <I>I am hearing it better now</I> slyším to teď lépe, <I>I am seeing it more clearly now</I> vidím to teď jasněji.
V případech jako <I>the director is hearing a singer</I> ředitel poslouchá (si šel poslechnout) nějakou zpěvačku, <I>she is seeing him to the door</I> doprovází ho ke dveřím jsou <I>see</I> a <I>hear</I> slovesa akční (s jiným významem). Srovnej též <I>I</I> (<I>can</I>) <I>see no stars in the sky</I> nevidím na nebi žádné hvězdy – <I>I am seeing stars</I> vidím andělíčky.
Význam „jednat, aby došlo k příslušnému vjemu“ je také význam akční, podléhající průběhové konjugaci. U <I>see</I> a <I>hear</I> jsou jiná slovesa: <I>look</I> dívat se a <I>listen</I> poslouchat, srov. <I>I am looking</I>/<I>listening, but I don’t see</I>/<I>hear anything</I> dívám se/poslouchám, ale nic nevidím/neslyším. Ostatní slovesa mají stejný tvar, srov. <I>I am smelling the flowers</I> přivoňuji ke květinám – <I>I smell flowers</I> cítím vůni květin, <I>I am feeling the surface</I> ohmatávám povrch – <I>I feel something sharp</I> cítím něco ostrého, <I>the cook is tasting the soup</I> kuchař ochutnává polévku – <I>I taste garlic in the soup</I> cítím v polévce česnek. Čeština má ve všech těchto případech jiné sloveso.
Ve sponové funkci <I>sound</I>, <I>smell</I> a <I>taste</I> tvoří pouze prosté tvary, srov. <I>it sounds strange</I> zní to divně, <I>it smells good</I> voní to dobře, <I>the food tastes delicious</I> jídlo má výtečnou chuť. Naproti tomu <I>feel</I> a <I>look</I> tvoří s životnými podměty tvary prosté i průběhové bez patrného významového rozdílu, srov. <I>You’re looking grand!</I> (Wilson 200) Vypadáš báječně! <I>Well, you don’t look very dangerous this morning.</I> (Queen 24) Dnes ráno nevypadáš moc nebezpečně. Podobně <I>How do you feel</I> /<I>How are you feeling?</I> Jak se cítíte?
<note id="8.82.22/P67">
U neživotných podmětů bývá prostý tvar, např. <I>it looks like rain</I> vypadá to na déšť, avšak u konkrétních podmětů není průběhový tvar vyloučen, srov. <I>the garden looks</I>/<I>is looking lovely this morning</I> zahrada vypadá dnes ráno překrásně.
</note>
Z ostatních sponových sloves se mohou rekategorizovat v akční slovesa <I>be</I> a <I>have</I>. Zatímco věta <I>he is clever</I> (je chytrý) vyžaduje obecnou charakteristiku, <I>he is being clever</I> znamená „(v tomto okamžiku, v této chvíli) dělá chytrého“. Podobně <I>I am being quite frank with you</I> mluvím s vámi zcela otevřeně, <I>I know I am being cowardly</I> vím, že si počínám zbaběle. <I>I expect I’m being silly... – No, you’re not being silly.</I> (Adams 91). Počínám si asi hloupě. – Ne, nepočínáš si hloupě.
<I>Have</I> nabývá dějové povahy ve spojení s různými substantivy, např. <I>he is having lunch</I> (právě) obědvá, <I>we are having a grand time</I> máme se báječně, <I>have a heart! – I am having a heart</I> měj slitování! – mám slitování, <I>the play is having a long run</I> ta hra se dává už dlouho aj.
Příležitostně se vyskytují v průběhové konjugaci i jiná slovesa zásadně nedynamické povahy, např. <I>How do you find the trip? – Oh, I am adoring it</I>. Jak se vám líbí výlet. – Ohromně se mi líbí. <I>I would very much like to think that I am misunderstanding what you are saying.</I> Moc rád bych si myslel, že si nesprávně vykládám to, co říkáte. <I>I am hating myself</I> mám na sebe hroznou zlost, <I>I am wanting a miracle</I> chci zázrak. <I>Are you telling me that you failed?</I> Snad mi neříkáš, žes propadl? <I>I am not insisting, I am only suggesting</I> nenaléhám, pouze navrhuji aj. U těchto sloves se průběhový tvar vyskytuje pouze s životnými podměty, s neživotnými podměty je možný jen tvar prostý, srov. <I>the soup wants a little salt</I> polévka potřebuje trochu přisolit, <I>does it suggest anything to you?</I> naznačuje vám to něco?
V některých případech je užití prosté a průběhové konjugace spojeno s rozdílem ve významu, např. <I>I imagine he’ll come to his sense</I> myslím, že přijde k rozumu – <I>you’re imagining things</I> vymýšlíš si (<I>think</I>, <I>consider</I>, <I>wonder</I> viz 8.22.21a). Rozdíl mezi <I>I hope</I> – <I>I am hoping</I> spočívá v tom, že prostý tvar vyjadřuje naději pozitivněji (což vyplývá z omezené platnosti predikace vyjádřené průběhovým tvarem): <I>I am hoping you’ll come</I> (doufám, že přijdete) dává adresátovi větší možnost děj nerealizovat než <I>I hope you’ll come</I> (doufám, že přijdete).
S výrazy jako <I>more and more</I>, <I>less and less</I> nacházíme průběhový tvar i u sloves jako <I>matter</I>, <I>resemble</I>: <I>it’s mattering less and less</I> záleží na tom stále méně, <I>the baby is resembling his father more and more</I> dítě se čím dál tím více podobá svému otci.
Atelická slovesa (viz 8.71) užívají při odkazování na déletrvající přítomnost obou tvarů, např. <I>he lives</I>/<I>is living in a flatlet</I> bydlí v garsonce, <I>she works</I>/<I>is working at the post office</I> pracuje na poště, <I>he teaches</I>/<I>is teaching at grammar school</I> učí na gymnáziu. Ovšem i v tomto případě si oba tvary uchovávají svůj základní význam (prostý tvar dodává ději obecnější platnost, průběhový ho vyjadřuje jako dočasný, je spíše nasnadě možnost změny), což se může kontrastně projevit ve vhodném kontextu, např. <I>she teaches French, but at present she is also teaching English</I> (<I>she is substituting for the English teacher who is ill</I>) vyučuje francouzštině, ale v současné době též učí angličtinu (supluje za učitele angličtiny, který je nemocen).
<note id="8.82.22/P68">
Modální slovesa průběhové tvary netvoří (viz 8.41), ojediněle se vyskytuje průběhový tvar u opisu, např. <I>I’m having to stay here for the night</I> musím tu zůstat přes noc.
</note>
Děj aktuálně probíhající v déletrvající přítomnosti může být děj opakovaný, srov. <I>he is a night watchman, he sleeps in the morning</I> je nočním hlídačem, ráno spí (opakovaný děj obecně platný) – <I>he is sleeping in the morning this week because he has been put on the night shift</I> tento týden spí ráno, protože byl přeložen na noční směnu (opakovaný děj aktuálně probíhající v déletrvající přítomnosti). <I>It is vital for the accompanist to hear what the singer is doing.</I> (Moore 53) Je naprosto nutné, aby klavírista slyšel, co zpěvák dělá.
<I>Always</I> se vyskytuje jak s prostým, tak průběhovým tvarem, ale v různém významu: s prostým tvarem znamená <I>vždycky</I>, <I>při každé příležitosti</I>, s průběhovým tvarem má význam <I>pořád</I>, <I>ustavičně</I>. Např. <I>You always wait till the last moment.</I> (Beckett 10) Vždycky čekáš do poslední chvíle. <I>I know it sounds silly but people are always falling desperately in love with me.</I> (Axelrod 522) Vím, že to zní hloupě, ale lidi se do mne pořád beznadějně zamilovávají.
Průběhový tvar může v těchto případech kompenzovat nedostatek kontextu, srov. <I>that fellow is always acting</I> ten člověk pořád hraje – <I>that fellow always acts some part or other</I> ten člověk vždycky hraje nějakou roli, <I>such things are always happening</I> takové věci se dějí pořád – <I>such things always happen when you least expect them</I> takové věci se vždycky přihodí, když je nejméně čekáte.
Průběhový prézens vyjadřuje též děje budoucí (viz 8.82.21d), např. <I>I’ve brought you a present too. But you’re not having it.</I> (Owen 93) Přinesl jsem ti dárek. Ale nedostaneš ho.
(b) Průběhové préteritum vyjadřuje děj dočasného trvání, který aktuálně probíhal v určitém minulém okamžiku nebo déletrvající době minulé, např. <I>Suddenly we saw him. He was standing on tiptoe under a great dead oak with his braces around his neck.</I> (Lee 182) Náhle jsme ho uviděli. Stál na špičkách pod velkým suchým dubem se šlemi kolem krku. <I>I went to the pictures last week, and some old man was smoking it in front, a few rows away.</I> (Osborne, Look Back 87) Byla jsem minulý týden v biografu a nějaký starý člověk to kouřil několik řad přede mnou.
Rozdíl mezi <I>at seven-thirty I drove to the station</I> a <I>at seven-thirty I was driving to the station</I> spočívá v tom, že s prostým préteritem časové určení označuje počátek děje, kdežto průběhové préteritum vyjadřuje děj, který začal před dobou označenou časovým určením. České <I>o půl osmé jsem jel na nádraží</I> zahrnuje oba významy (1) o půl osmé jsem odjel na nádraží; (2) o půl osmé jsem už jel (jsem byl na cestě) na nádraží.
Při vyjadřování minulých dějů prostým nebo průběhovým tvarem je rozdíl mezi slovesy telickými a atelickými (viz 8.71). Prosté préteritum telických sloves, není-li ovlivněno kontextem, označuje děj, který dospěl k svému cíli (tj. komplexní pojetí děje odpovídající českému dokonavému vidu), kdežto průběhové préteritum vyjadřuje děj, který ještě nedospěl k svému cíli (kurzivní pojetí děje, v češtině nedokonavý vid); prostý a průběhový tvar zde tedy označují různou mimojazykovou skutečnost. Srovnej <I>the weather changed</I> počasí se změnilo – <I>the weather was changing</I> počasí se měnilo, <I>the temperature rose</I> teplota stoupla – <I>the temperature was rising</I> teplota stoupala, <I>he died</I> zemřel – <I>he was dying</I> umíral, <I>the plane landed</I> letadlo přistálo – <I>the plane was landing</I> letadlo přistávalo apod.
U momentánních sloves (viz 8.72) průběhový tvar vyjadřuje děj opakovaný, srov. <I>the door banged</I> dveře bouchly – <I>the door was banging</I> dveře bouchaly. Iterativnost může ovšem vyjadřovat i prostý tvar, srov. <I>the door banged several times</I> dveře několikrát bouchly.
U atelických sloves prosté a průběhové préteritum označuje stejnou mimojazykovou skutečnost, neboť tato slovesa zahrnují kurzivnost jako inherentní rys své sémantické struktury. Rozdíl je pouze v pojetí aktuálnosti děje. Např. (<I>when I saw her</I>) <I>she carried</I>/<I>was carrying a basket</I> (když jsem ji viděl) nesla koš, (<I>that night</I>) <I>she wore</I>/<I>was wearing a pink dress</I> (toho večera) měla na sobě růžové šaty, <I>the girl held</I>/<I>was holding something in her hand</I> děvčátko drželo něco v ruce, <I>he watched</I>/<I>was watching the ducks on the pond</I> pozoroval kachny na rybníku apod.
Průběhové préteritum často vyjadřuje současnost s jiným dějem minulým, např. <I>we started on the journey when it was getting light</I> vydali jsme se na cestu, když se rozednívalo. U telických sloves je užití průběhového préterita v těchto případech obligatorní, neboť prostý tvar označuje děj dokončený, a tedy předcházející, srov. <I>we started on the journey when it got light</I> vydali jsme se na cestu, když se rozednilo.
U atelických sloves stačí k vyjádření současnosti prostý tvar (pokud ovšem spojka připouští mezi oběma ději vztah současnosti), např. <I>I remembered it when I walked</I>/<I>was walking to the station</I> vzpomněl jsem si na to, když jsem šel na nádraží, <I>he broke his leg when he played</I>/<I>was playing football</I> zlomil si nohu, když hrál kopanou. <I>The weather cleared as we drove into Weston.</I> (Lee 194) Když jsme přijížděli do Westonu, počasí se vyjasnilo.
<note id="8.82.22/P69">
Připouští-li predikace kurzivní i komplexní interpretaci, může po <I>when</I> dojít k dvojznačnosti, např. <I>when we climbed the hill it began to rain</I> (1) když jsme stoupali na kopec (= <I>when we were climbing the hill</I>); (2) když jsme vystoupili na kopec (= <I>when we had climbed the hill</I>).
</note>
Současné děje vyjadřuje průběhové préteritum v závislých větách obsahových po minulém čase ve větě řídící, např. <I>I asked you where you were going</I>. (Osborne, Look Back 58) Ptal jsem se tě, kam jdeš. <I>I told them I wasn’t feeling well.</I> (Wilson 32) Řekl jsem jim, že mi není dobře.
Průběhové préteritum sloves pohybu může vyjadřovat děj následný, stejně jako préteritum vazby <I>be going to</I>: <I>Just before she died she told me she was leaving everything to me.</I> (Wilson 165) Krátce před svou smrtí mi řekla, že mi všechno odkazuje. <I>If I only knew what was going to happen.</I> (Osborne, Look Back 26) Kdybych tak věděla, co se stane.
<note id="8.82.22/P70">
V případě jako <I>your teacher was telling me that you don’t apply yourself</I> (tvůj učitel mi říkal, že se nesnažíš) průběhové préteritum odkazuje na nespecifikovanu dobu minulou (podobně jako prosté préteritum <I>I thought you were away</I> myslel jsem, že jsi pryč).
</note>
(c) Průběhové perfektum má stejný význam jako perfektum prosté, tj. vyjadřuje děj relevantní z hlediska přítomnosti, který se odehrál v neurčité, nespecifikované době minulé. K tomu přistupují základní rysy průběhové konjugace: dočasnost trvání děje a zřetel k jeho průběhu. Odkaz na určitou dobu se u perfekta neuplatňuje, neboť je neslučitelný s jeho základním referenčním významem. Větší významová určitost průběhové konjugace se u perfekta stejně jako u ostatních průběhových tvarů projevuje schopností vyskytovat se samostatně bez předmětových nebo adverbiálních doplnění, srov. <I>your eyes are red, you’ve been crying</I> máš červené oči, ty jsi plakala (nikoliv *<I>you’ve cried</I>); <I>have you been reading?</I> četl jsi? (nikoliv *<I>have you read</I>?).
