'cname','ctext'$
'1 Základní jednotka morfologie','Základní jednotky morfologie jsou slovo a morfém.
Obecná definice slova a názory na jeho status jakožto základní jednotky morfologie se liší. Nejsnáze se slovo určuje v jazyce psaném, v němž se jednotlivá slova oddělují mezerami. I toto kritérium však selhává v případě slov, jejichž pravopis kolísá (viz 1.4 kompozita).
Jako základní jednotka morfologie se proti slovu někdy klade morfém. Slovo totiž funguje především jako základní prostředek pojmenovávací, tj. tvoří jednotku roviny lexikální, a jako složka věty je též jednotkou roviny syntaktické. Specifickou jednotkou morfologickou je však slovní tvar, forma slova.'$
'1.1','Jak slovo, tak morfém lze definovat jako stabilní komplex fonémů (v jazyce psaném grafémů) majících určitý význam (popř. významy). Slovo a morfém se však liší stupněm samostatnosti a možností dalšího dělení. Zatímco slovo je útvar samostatný a většinou i dělitelný v menší významově a formálně zřetelné složky (morfémy), je morfém útvar nesamostatný a morfologicky dále nedělitelný. Existence morfému je tak vázána na slovo. Skládá-li se slovo z jediného morfému, splývá morfém se slovem. Monomorfémních slov je v angličtině v důsledku značného počtu jednoslabičných slov mnohem více než v češtině, např. <I>clerk</I> úředník, <I>hair</I> vlasy, <I>win</I> vyhrát (české ekvivalenty se skládají z dvou až tří morfémů; monomorfémní česká slova jsou např. <I>snad</I>, <I>jen</I>, <I>však</I> apod.). Monomorfémnost se neomezuje na slova jednoslabičná, srov. ang. <I>travel</I> cestovat, <I>open</I> otevřený, české <I>přece</I> aj.
Polymorfémní slovní struktura je v angličtině zastoupena u slov odvozených, a to jak domácích, např. <I>free-dom</I> svoboda, <I>hard-ship</I> útrapa, <I>help-less</I> bezmocný, <I>friend-li-ness</I> přátelskost; tak přejatých, např. <I>dis-arma-ment</I> odzbrojení, <I>ir-regular-ity</I> nepravidelnost, <I>simpl-ify</I> zjednodušit apod. Polymorfémní slova cizího původu jsou ovšem pro mluvčí bez klasického vzdělání často nerozložitelná, např. <I>helicopter</I> helikoptéra, <I>solstice</I> slunovrat apod. Dále se s polymorfémní strukturou setkáváme, je-li přítomná flektivní koncovka, např. <I>friend-s, he cough-ed, I’m com-ing</I> aj.
Slovo může být realizováno jediným fonémem, např. české spojky <I>a</I> a <I>i</I>, předložky <I>k</I>, <I>s</I>, <I>v</I>, <I>z</I>, anglická citoslovce [əʊ] <I>oh,</I> [ɑː] <I>ah</I> a zájmeno 1. os. sg. [aɪ] <I>I</I>.
Stejně jako jediný foném může realizovat celé slovo, tak i jedno slovo může realizovat celou větu. Jednoslovná realizace věty se v angličtině vyskytuje u jednočlenných vět jmenných (viz 12.4). Jde ovšem o útvar okrajový, výjimečný, neboť funkce slova a funkce věty se zásadně liší. Slovo pojmenovává jevy mimojazykové skutečnosti, kdežto věta o ní něco vypovídá.'$
'1.2','Slova se dělí na autosémantická, tj. plnovýznamová, která mohou sama o sobě realizovat větu (např. <I>Attention!</I> Pozor! <I>Stop!</I> Zastavte! <I>Gently!</I> Opatrně!), a na slova synsémantická, která tuto schopnost nemají (např. členy <I>a</I>, <I>the</I>, tvary jako ’<I>s</I> [<I>is</I>, <I>has</I>], ’<I>ve</I> [<I>have</I>], ’<I>d</I> [<I>had</I>, <I>would</I>], přivlastňovací zájmena nesamostatná <I>my</I>, <I>your</I>, <I>her</I>, <I>our</I>, <I>their</I> atd., předložky <I>of</I>, <I>to</I>, spojky <I>as</I>, <I>if</I> apod.).
Synsémantika zahrnují slova gramatická (funkční) a pomocná. Gramatická slova nabývají plného významu teprve ve spojení s příslušnými slovy plnovýznamovými. Syntakticky autosémantika realizují větné členy, kdežto synsémantika (kromě zájmen) nikoliv. Vyjadřují pouze vztahy mezi slovy (předložky) nebo větami (spojky), popř. význam větného členu modifikují (členy).
<note id="1.2/P01">
V metajazyce může být užito každého slova samostatně, např. <I>Did you say a or the? – The.</I>
</note>
<note id="1.2/P02">
Zvláštní skupinu slov tvoří deiktika (z řeckého deixe = ukázání), tj. slova, jejichž reference závisí na situaci promluvy (orientační ukazatelé situace promluvy): zájmena 1. a 2. osoby, zájmena ukazovací, adverbiální výrazy <I>here</I> zde, <I>now</I> nyní, <I>today</I> dnes, <I>tomorrow</I> zítra, <I>yesterday</I> včera (viz též 8.82).
</note>'$
'1.3','Anglické a české slovo si v podstatě odpovídá, avšak jsou některé rozdíly. Tak po stránce zvukové je české slovo vyznačeno přízvukem na první slabice (výjimku tvoří spojení s jednoslabičnou předložkou, kde přízvuk přechází na předložku, a enklitika a proklitika, která bývají nepřízvučná). Přízvuk tak signalizuje začátek slova, což posluchači usnadňuje segmentaci souvislé řeči. V angličtině je přízvuk součástí morfematické struktury slov plnovýznamových, kdežto gramatická a pomocná slova jsou zpravidla nepřízvučná. Nadto není vázán na určitou slabiku slova, takže se souvislá řeč člení na nepravidelné takty, skládající se z jedné přízvučné a různého počtu nepřízvučných slabik, přičemž se hranice taktu nemusí krýt s hranicí slova. Srov. <I>a very ingenious invention</I> [ə ˈverɪ ɪn|ˈdʒiːniəs ɪn|ˈvenʃən] ˈvelmi ˈdůmyslný ˈvynález.
Další rys slova je jeho vnitřní stabilita, kompaktnost. Fonémy, které slovo vytvářejí, nelze přemístit, stejně tak nelze u polymorfémních slov přemístit jednotlivé morfémy. Rovněž nelze do vnitřní struktury slova vsunout další prvek nebo z ní některý prvek vypustit.
<note id="1.3/P03">
Zvuková podoba slova může ovšem mít různou realizaci v závislosti na tempu řeči, pečlivosti výslovnosti apod. V angličtině je variabilnost zvukové podoby slova větší než v češtině, zejména pokud jde o realizaci nepřízvučných slabik, v nichž se nepřízvučný vokál často vypouští.
</note>
Na rozdíl od nepřemístitelnosti svých složek je slovo jako celek přemístitelné nebo aspoň oddělitelné jinými slovy. Přemístitelnost slov je ovšem omezena jejich kombinační schopností a typem jazyka. Ve flektivní češtině s volným slovosledem je větší než v analytické angličtině, v níž jsou slovosledné varianty omezeny jednak gramatickou funkcí slovosledu, jednak jeho větší ustáleností. Srovnej: <I>The girl slowly turned the pages of the book.</I> Dívka pomalu obracela stránky knihy. <I>Slowly the girl turned the pages of the book.</I> Pomalu dívka obracela stránky knihy. <I>The girl turned the pages of the book slowly.</I> Dívka obracela stránky knihy pomalu. <I>*Slowly turned the girl the pages of the book.</I> Pomalu obracela dívka stránky knihy. *The pages of the book turned the girl slowly. Stránky knihy obracela dívka pomalu.
<note id="1.3/P04">
Hvězdička před slovem nebo větou označuje formy, které neexistují.
</note>
V případě předložek se angličtina liší od češtiny tím, že za určitých podmínek připouští jejich přemístitelnost. V češtině má předložka neměnné postavení před členem, který řídí, kdežto v angličtině může být postponována do postavení za slovesem, srov. <I>From whom did you get it? / Who(m) did you get it from?</I> Od koho jste to dostal? (V kontaktní vztažné větě a ve vztažné větě uvozené pomocí <I>that</I> je postpozice předložky obligatorní, viz 16.22.21 a, b).
Na samé hranici slovní samostatnosti jsou pomocná slova ve složených tvarech, která zde vlastní význam nemají, nýbrž jen přispívají k významu celku. Blíží se tak flektivním morfémům, které jim někdy skutečně ve flektivnějším jazyce odpovídají. Složené tvary s pomocnými slovy se vyskytují v angličtině i češtině, avšak v angličtině jsou zastoupeny ve větší míře, srov. anglickou konjugaci a deklinaci (8.82.1, 3.51.6, 3.52).'$
'1.4','Jak již bylo uvedeno (1.1), angličtina má ve srovnání s češtinou velké množství slov monomorfémních, tj. morfologicky nerozložitelných, jednoslabičných i víceslabičných, např. <I>door</I> dveře, <I>look</I> vypadat, pohled, <I>fault</I> chyba, <I>money</I> peníze, <I>office</I> kancelář apod. Sklon k monosylabismu se projevuje též v zkracování slov, zejména v hovorovém jazyce, např. <I>plane</I> (brit. <I>aeroplane</I>, amer. <I>airplane</I>) letadlo, <I>pram</I> (<I>perambulator</I>) dětský kočárek, <I>ad</I> (<I>advertisement</I>) inzerát, <I>lab</I> (<I>laboratory</I>) laboratoř, <I>fridge</I> (<I>refrigerator)</I> lednička, <I>mac</I> (<I>mackintosh</I>) plášť do deště aj. Někdy zkratka původní slovo zcela zatlačila, např. <I>bus</I> (<I>omnibus</I>) autobus, jindy se vyskytuje jen ve slangu, např. <I>tec</I> (<I>detective</I>) detektiv, <I>doc</I> (<I>doctor</I>) doktor.
Monosylabická slova, pokud nemají flektivní sufix, se skládají jen z báze (základu, bázového morfému). Bázových morfémů je v jazyce velké množství a tvoří otevřenou řadu, i když slova založená na zcela novém bázovém morfému vznikají zřídka (např. názvy výrobků vzniklé z kombinací vytvořených počítačem).
Proti bázovým morfémům stojí morfémy derivační (afixy: prefixy, sufixy a infixy) a morfémy flektivní, kterých je omezený počet.
Prefixy, sufixy a infixy se od sebe liší pozicí. Prefixy (předpony) stojí před bázovým morfémem, sufixy (přípony) za ním a infixy uvnitř slova. Všechny afixy se pak od flektivních morfémů liší tím, že mají funkci slovotvornou, tj. odvozují od základu nové slovo s jiným významem, srov. <I>rich</I> bohatý – <I>enrich</I> obohatit, <I>cloud</I> mrak <I>– cloudy</I> zamračený. Naproti tomu flektivní morfémy mají funkci tvaroslovnou, tj. netvoří nová slova, nýbrž tvary od téhož slova, srov. <I>rich</I> – <I>richer</I> – <I>richest</I> bohatý – bohatší – nejbohatší, <I>cloud</I> – <I>clouds</I> mrak – mraky. Formálně se flektivní sufixy liší od derivačních tím, že pokud nemají formu alternace, jsou poslední složkou slova, tj. následují až za morfémy derivačními, např. <I>invent</I> vynalézt – <I>invention</I> vynález – <I>inventions</I> vynálezy<I>, deep</I> hluboký – <I>deepen</I> prohloubit (se) – <I>the conflict deepened</I> konflikt se prohloubil.
Slova odvozená domácími prefixy jsou např. <I>asleep</I> spící (srov. <I>sleep</I> spát, spánek), <I>belittle</I> zlehčovat (srov. <I>little</I> malý), <I>forehead</I> čelo (srov. <I>head</I> hlava), <I>unwilling</I> neochotný (srov. <I>willing</I> ochotný), <I>unpack</I> rozbalit (srov. <I>pack</I> balit); cizími prefixy např. <I>dishonest</I> nepoctivý (srov. <I>honest</I> poctivý), <I>infallible</I> neomylný (srov. <I>fallible</I> omylný), <I>refuel</I> doplnit pohonnou látku (srov. <I>fuel</I> pohonná látka, palivo), <I>premature</I> předčasný (srov. <I>mature</I> zralý), <I>co-operate</I> spolupracovat (srov. <I>operate</I> působit, provozovat) aj. Slova odvozená domácími sufixy jsou např. <I>reader</I> čtenář (srov. <I>read</I> číst), <I>rainy</I> deštivý (srov. <I>rain</I> déšť, pršet), <I>beginning</I> začátek (srov. <I>begin</I> začít), <I>shorten</I> zkrátit (srov. <I>short</I> krátký), <I>tenfold</I> desetinásobný (srov. <I>ten</I> deset) aj.; cizími sufixy, např. <I>regrettable</I> politováníhodný (srov. <I>regret</I> litovat), <I>employee</I> zaměstnanec (srov. <I>employ</I> zaměstnat), <I>extension</I> rozšíření, prodloužení (srov. <I>extend</I> rozšířit, prodloužit), <I>confirmation</I> potvrzení (srov. <I>confirm</I> potvrdit), <I>difference</I> rozdíl, <I>diffferent</I> různý (srov. <I>differ</I> lišit se), <I>accuracy</I> přesnost (srov. <I>accurate</I> přesný) aj. Cizích prefixů a sufixů je ve srovnání s domácími v angličtině mnohem více.
<note id="1.4/P04">
Infixy se v angličtině a češtině nevyskytují. Za prvek infixové povahy se někdy považuje <I>n</I> v případech jako <I>passenger</I> (cestující), <I>messenger</I> (posel) v protikladu k <I>passage</I> (cesta), <I>message</I> (poselství, vzkaz); v češtině iteraktivní morfém u sloves typu sedět – sedávat.
</note>
Na rozdíl od češtiny je v angličtině běžné tvoření hybridních odvozenin (cizími sufixy od domácích základů), např. <I>understandable</I> pochopitelný, <I>starvation</I> hladovění, <I>hostess</I> hostitelka, <I>ex-husband</I> bývalý (dřívější) manžel, <I>non-smoker</I> nekuřák, <I>talkative</I> povídavý, <I>thunderous</I> bouřlivý apod.
U malého počtu domácích substantiv se dochovaly pozůstatky staršího jazykového stadia, v němž byla sufixace provázena alternací kmenové samohlásky, např. <I>long</I> dlouhý – <I>length</I> délka, <I>strong</I> silný – <I>strength</I> síla, <I>broad</I> široký – <I>breadth</I> šířka, <I>wide</I> [waɪd] široký – <I>width</I> [wɪdθ] šířka, <I>wise</I> [waɪz] moudrý – <I>wisdom</I> [wɪzdəm] / moudrost.
Tento derivační typ, v domácí slovní zásobě neproduktivní, je rozvinut u slov odvozených cizími sufixy, které váží přízvuk na určitou slabiku, což mívá důsledky též pro kvalitu samohlásek. Některé cizí sufixy se navíc pojí s dlouhou či krátkou kvantitou přízvučné samohlásky, srov. <I>precise</I> [prɪˈsaɪs] přesný – <I>precision</I> [prɪˈsɪʒən] přesnost, <I>able</I> [eɪbl] schopný – <I>ability</I> [əˈbɪlətɪ] schopnost, <I>similar</I> [sɪmələ] podobný – <I>similarity</I> [sɪməˈlærətɪ] podobnost, <I>various</I> [veərɪəs] různý – <I>variety</I> [vəˈraɪətɪ] různost, <I>courage</I> [kʌrɪdʒ] odvaha – <I>courageous</I> [kəˈreɪdʒəs] odvážný, <I>democrat</I> [deməkræt] demokrat – <I>democracy</I> [dɪˈmɒkrəsɪ] demokracie, <I>analyse</I> [ænəlaɪz] analyzovat – <I>analysis</I> [əˈnæləsɪs] analýza, <I>analytic</I> [ˌænəˈlɪtɪk] analytický apod. V češtině se vyskytuje pouze alternace fonémů, např. <I>odvaha</I> – <I>odvážný</I>, <I>zlato</I> – <I>pozlacený</I>, <I>nést</I> – <I>nosit</I>.
Zvláštní způsob derivace, který vůbec nemá v češtině obdobu, je tzv. <I>back-formation.</I> Spočívá v tom, že je při něm směr normálního derivačního procesu obrácen. Základní člen derivačního vztahu vznikl nebo byl přejat (popř. byl interpretován) jako slovo se sufixem, např. <I>baby-sitter</I> osoba hlídající děti, <I>housekeeper</I> hospodyně, <I>difficulty</I> obtíž, <I>pedlar</I>, <I>peddler</I> podomní obchodník, <I>reminiscence</I> vzpomínka, <I>editor</I> redaktor, vydavatel, <I>vacuum-cleaner</I> vysavač aj. K němu pak bylo dodatečně vytvořeno nové slovo odtržením sufixu, srov. <I>baby-sit</I> hlídat děti, <I>housekeep</I> vést domácnost, <I>difficult</I> obtížný, <I>peddle</I> prodávat po domech, <I>reminisce</I> vzpomínat, <I>edit</I> redigovat, vydávat, <I>vacuum-clean</I> vysávat vysavačem apod.
Také u složených slov jsou vedle shodných typů některé rozdíly. Oba jazyky mají kompozita germánská (v nichž určující složka předchází před určovanou), např. <I>earthquake</I> zemětření, <I>waterfall</I> vodopád, i románská (v nichž určovaná složka stojí před určující), např. angl. <I>pickpocket</I> kapesní zloděj, <I>cut(-)throat</I> hrdlořez, <I>sawbones</I> řezník (žertovně o chirurgovi), <I>scarecrow</I> strašák, čes. kazisvět, neznaboh.
V angličtině se složená slova nejčastěji píší dohromady, např. <I>bricklayer</I> zedník, <I>airtight</I> vzduchotěsný, <I>drawbridge</I> zdvihací most. Nesamostatnost první složky nebo spojovací vokál, příznačná pro jazyk flektivní (srov. čes. <I>bratrovrah, šedomodrý</I>), se v angličtině vyskytuje jen u kompozit obsahujících cizí elementy, např. <I>Anglo-Saxon</I> anglosaský, <I>speedometer</I> tachometr. Pravopis kompozit však kolísá, vedle psaní dohromady, např. <I>daylight</I> denní světlo, <I>windmill</I> větrný mlýn, <I>headache</I> bolení hlavy, se vyskytuje pravopis se spojovací čárkou, např. <I>taxi-driver</I> taxikář, <I>air-conditioning</I> klimatizace, <I>self-esteem</I> sebeúcta, a nadto se některá kompozita píší oběma způsoby, např. <I>head(-)master</I> ředitel školy, <I>frost(-)bite</I> omrzlina, <I>flash(-)light</I> bleskové nebo signalizační světlo. Vyskytuje se i psaní zvlášť, vedle něhož se často píše spojovací čárka (psaní spojovací čárky je hojné v britské angličtině, kdežto v americké angličtině je častější buď psaní dohromady nebo zvlášť), např. <I>washing machine</I>/<I>washing-machine</I> pračka, <I>fire engine</I>/<I>fire-engine</I> hasičská stříkačka, <I>waiting room</I>/<I>wating-room</I> čekárna, <I>diving suit</I>/<I>diving-suit</I> potápěčský oblek aj. V těchto případech je kritériem kompozita přízvuková struktura (nejčastěji jednotící hlavní přízvuk na první složce) a specializovaný význam (význam kompozita je zpravidla zúžen na speciální případ(y) příslušného významu). Mezi kompozity a slovními spojeními je ovšem plynulý přechod.
Jak ukazují uvedené příklady a jejich ekvivalenty, jednotlivá kompozita si v angličtině a češtině často neodpovídají. Srovnej <I>lazy-bones</I> (kompozitum) <I>lenoch</I> (odvozené slovo), <I>corn</I> (jednoduché slovo) <I>kuří oko</I> (sousloví), <I>warship</I> (kompozitum) <I>válečná loď</I> (sousloví) aj.
V obou jazycích se dále vyskytují kompozita bahuvríhiová, která pojmenovávají celek vytčením jedné jeho části, např. <I>Bluebeard</I> Modrovous. Také u tohoto typu si jednotlivé případy v angličtině a češtině často neodpovídají, srov. <I>hunch-back</I> hrbáč, <I>chatterbox</I> žvanil, mluvka, <I>redhead</I> zrzek, zrzka.
<note id="1.4/P05">
U sloves s adverbiální částicí, např. <I>pick up</I> sebrat, zdvihnout, <I>put out</I> uhasit, zhasit, <I>turn off</I> vypnout, zavřít apod., svědčí pro slovní samostatnost částice její přemístitelnost, srov. <I>They put out the fire</I> / <I>They put the fire out.</I> Uhasili oheň.
</note>
V angličtině se vyskytují dva typy kompozit, které jsou v češtině řídké. Je to jednak typ založený na slovotvorném procesu <I>blending</I>, tj. nové slovo (<I>blend</I>, <I>portmanteau word</I>) se tvoří vynecháním konce jedné složky a začátku složky druhé, např. <I>brunch</I> (<I>breakfast</I> + <I>lunch</I>)<I>, smog</I> (<I>smoke</I> + <I>fog</I>)<I>, motel</I> (<I>motorists’ hotel</I>)<I>, breathalyser</I> (<I>breath</I> + <I>analyser</I>)<I>, Eurovision</I> (<I>European television</I>)<I>, shamateur</I> (<I>sham</I> + <I>amateur</I>) apod. Druhý typ představují tzv. citátové složeniny, které vznikají přenesením části věty do jiného syntaktického okolí, např. <I>What you need is a pick-me-up.</I> Potřebuješ životabudič (něco na posilnění), <I>a happy-go-lucky sort of attitude towards life</I> bezstarostný postoj k životu, <I>the die-hards</I> tvrdošíjní konzervativci, <I>an out-of-the-way place</I> odlehlé místo, <I>forget-me-not</I> pomněnka, <I>hard-to-get items</I> úzkoprofilové zboží aj. Citátové složeniny jsou typ velmi produktivní a často vznikají ad hoc, např. <I>the swallowed-up-by-the-earth theory</I> teorie, že se propadl do země, <I>young men largely recruited from leaning-up-against-the-walls-of-public-houses industries</I> mladí mužové rekrutující se většinou z těch, jejichž zaměstnáním je opírat se o zdi hospod, <I>the garden had that neglected,</I> ‘<I>somebody-else-can-do-it</I>’ <I>look so often found in communal property</I> zahrada vypadala zanedbaně, jak je tomu tak často u společného majetku, protože „to může udělat někdo jiný“.'$
'1.5','V angličtině táž fonematická struktura často vyjadřuje dva (i více) zcela různé významy. Slova mající stejnou zvukovou podobu, avšak rozlišená v psaném jazyce jsou homofona, např. [səʊ] <I>sew</I> šít – <I>sow</I> sázet, [sʌn] <I>sun</I> slunce – <I>son</I> syn, [heə] <I>hair</I> vlasy – <I>hare</I> zajíc, [daɪ] <I>die</I> umřít – <I>dye</I> barva, barvivo, [piːs] <I>piece</I> kus – <I>peace</I> mír, [həʊl] <I>hole</I> díra – <I>whole</I> celek, celý, [prɒfɪt] <I>profit</I> zisk – <I>prophet</I> prorok, [reɪn] <I>rain</I> déšť pršet – <I>reign</I> vláda, panovat – <I>rein</I> uzda, [raɪt] <I>write</I> psát – <I>right</I> právo, pravý, správný – <I>rite</I> obřad, rituál, [hiːl] <I>heal</I> hojit – <I>heel</I> pata, podpatek, [weɪ] <I>way</I> cesta – <I>weight</I> vážit, [bɜːθ] <I>birth</I> narození – <I>berth</I> lůžko (v lodní kabině, ve vlaku), [pleɪn] <I>plain</I> planina, rovina – <I>plane</I> geometrická rovina, letadlo aj. Homofonie je v angličtině častá zejména u slov jednoslabičných.
Opačný případ, kdy jedna psaná forma odpovídá dvěma různým zvukovým, se v angličtině vyskytuje také, např. <I>read</I> (1) [riːd] číst, přítomné tvary slovesa <I>read</I>, (2) [red] préteritum a minulé příčestí slovesa <I>read</I>; <I>lead</I> (1) [liːd] vést, (2) [led] olovo; <I>bow</I> (1) [bəʊ] luk, (2) [baʊ] poklona, poklonit se; <I>row</I> (1) [rəʊ] veslo, veslovat, (2) [raʊ] hádka, výtržnost; <I>entrance</I> (1) [entrəns] vchod, (2) [ɪnˈtrɑːns] uchvátit, strhnout. V tomto případě jde o homografa.
Slova s různými významy mající stejnou formu jak psanou, tak i mluvenou jsou homonyma, např. kind [kaɪnd] (1) laskavý, (2) druh; bark [bɑːk] (1) štěkat, (2) kůra (na stromě), (3) bárka; date [deɪt] (1) datum, (2) datle aj.
Proti homonymům stojí synonyma, tj. slova s různou formou a stejným významem, např. <I>shut</I> – <I>close</I> zavřít, <I>change</I> – <I>alter</I> změnit, <I>continue</I> – <I>go on</I> pokračovat, <I>mistake</I> – <I>error</I> chyba, <I>stop</I> – <I>cease</I> přestat, <I>deep</I> – <I>profound</I> hluboký, <I>end</I> – <I>finish</I> skončit, <I>hide</I> – <I>conceal</I> skrýt, <I>buy</I> – <I>purchase</I> koupit, <I>incredible</I> – <I>unbelievable</I> neuvěřitelný aj. Synonym má angličtina velké množství v důsledku velkého počtu přejatých slov francouzsko-latinského původu. Dokonalá synonyma jsou však velmi vzácná, většinou jsou slova synonymní jen v některém ze svých významů, popř. v některých kontextech, a/nebo jsou rozlišena stylisticky (tak slova francouzsko-latinského původu jsou většinou příznačná pro vyšší styl, slova germánského původu jsou obvyklá v běžné mluvě).
Od synonym je třeba lišit případy variantních forem slova, např. <I>clinch</I>/<I>clench</I> zanýtovat, <I>inquiry</I>/<I>enquiry</I> dotaz. Patří sem jednak nečetné případy kolísání pravopisu jako <I>judg(e)ment</I> soud, <I>jewel(le)ry</I> šperky, u sufixu -<I>ize</I>/<I>ise</I> (<I>organise</I>/<I>organize, recognise</I>/<I>recognize</I> aj.); lze sem řadit i uvedený prefix <I>en-</I>/<I>in-</I> u některých slov (<I>en-</I>/<I>inquiry, en-</I>/<I>indorse</I>). Daleko větší je kolísání ve výslovnosti. Četná i velmi běžná slova mají dvě i více výslovnostních variant (diafona), např. <I>again</I> [əˈɡen], [əˈɡeɪn] zase, opět, <I>towards</I> [təˈwɔːdz], [tʊˈwɔːdz], [twɔːdz], [tɔːdz], [tɔədz] směrem k, <I>contrast</I> sb[JP1]. [kɒntrɑːst], [kɒntræst] kontrast, <I>contents</I> [kɒntents], [kənˈtents] obsah, <I>direct</I> [daɪˈrekt], [dɪˈrekt] přímý, řídit, <I>organization</I> [ˌɔːɡənaɪˈzeɪʃən], [ˌɔːɡənɪˈzeɪʃən], organizace aj. Kolísá zejména výslovnost odborných latinsko-řeckých termínů, s nimiž se mluvčí většinou seznamuje prostřednictvím psané formy (<I>eye-words</I>), např. <I>abdomen</I> [ˈæbdəmən], [æbˈdəʊmen], [-mɪn], břicho, <I>erratum</I> [eˈrɑːtəm], [ɪˈrɑːtəm], [ɪˈreɪtəm], [eˈreɪtəm] tisková chyba, <I>respiratory</I> [rɪsˈpaɪərətərɪ], [resˈp-], [rəsˈp-], [respɪrətərɪ], [respɪreɪtərɪ] dýchací a mnoho dalších[JP2].'$
