'cname','ctext'$
Jindy různá determinace může být důsledkem počitatelného či nepočitatelného pojetí (u substantiv, kterých se užívá obojím způsobem), např. <I>There was a short silence.</I> Chvilku bylo ticho. <I>– There was absolute silence.</I> Bylo naprosté ticho. <I>The event aroused great interest.</I> Ta událost vzbudila velký zájem. – <I>He takes a great interest in art.</I> Má velký zájem o umění. <I>Our dream has become</I> (<I>a</I>) <I>reality.</I> Náš sen se stal skutečností.
Konečně existují případy volné variace, kdy vedle sebe existuje užití s členem, popř. s různými členy a/nebo bez členu bez rozdílu ve významu. Vedle ustálených vazeb je sem možno řadit nomina actionis, tj. sekundární predikace, neboť predikace nemá kategorii určenosti. S fakultativním užitím členu se zde setkáváme pouze, jde-li o určenost kataforickou, nikoliv situační nebo anaforickou, např. (<I>The</I>) <I>robbery of old people is a heinous crime.</I> Oloupení starých lidí je ohavný zločin, (<I>the</I>) <I>research into the problem</I> zkoumání toho problému, <I>(the) dismisal from hospital</I> propuštění z nemocnice apod.
Jiné případy kolísání v užívání členu se omezují na více méně ustálené vazby, např. <I>to throw</I> (<I>a</I>) <I>new light on</I> vrhnout nové světlo na, <I>I’ll do it</I> (<I>the</I>) <I>first thing in the morning</I> / (<I>the</I>) <I>last thing before going to bed</I> udělám to hned ráno / jako poslední věc, než půjdu spát, <I>at this time of</I> (<I>the</I>) <I>day/</I>(<I>the</I>) <I>year</I> v tuhle denní/roční dobu, <I>take</I> (<I>a</I>) <I>pride in sth</I> být na něco pyšný, <I>to look at</I>/<I>watch</I> (<I>the</I>) <I>TV</I> (<I>televison</I>) dívat se na televizi, <I>on an</I> (<I>the</I>) <I>average</I> v průměru, <I>in</I> (<I>the</I>) <I>spring</I> na jaře, <I>in</I> (<I>the</I>) <I>summer</I> v létě, <I>in</I> (<I>the</I>) <I>early</I>/<I>late autumn</I> v časném/pozdním podzimu aj.'$
'3.4. Rod','Substantivní kategorie rodu, je-li plně rozvinuta, jak je tomu např. v češtině, představuje primárně kategorii gramatickou a jen v omezené míře kategorii sémantickou. Rozdíly v mimojazykové skutečnosti odráží pouze u osob a některých zvířat, a to tak, že substantivní rod maskulinum odpovídá mužskému pohlaví, femininum ženskému pohlaví a neutrum označuje mláďata, srov. <I>muž</I>, <I>hřebec</I>, <I>kohout</I> (mask.) – <I>žena</I>, <I>klisna</I>, <I>slepice</I> (fem.) – <I>dítě</I>, <I>hříbě</I>, <I>kuře</I> (neutrum).
U ostatních substantiv, označujících neživotné entity a většinu živočichů, nemá gramatický rod přímý vztah k mimojazykové skutečnosti, a představuje tedy klasifikaci čistě jazykovou. Skutečnost, že např. <I>stůl</I>, <I>kos</I> jsou rodu mužského, <I>židle</I>, <I>pěnkava</I> rodu ženského a <I>okno</I>, <I>káně</I> rodu středního, nikterak nevyplývá z povahy označovaných předmětů a živočichů. Rodové zařazení těchto substantiv závisí na jejich formě, a to na derivačním sufixu a/nebo příslušnosti k deklinačnímu typu.
V češtině se gramatická kategorie rodu projevuje příslušností substantiva k určitému deklinačnímu typu, kongruencí větných členů, které jsou na substativu syntakticky závislé, a prostředky odkazování, např. <I>Jana měla na sobě nové šaty, které jí velmi slušely</I>.
V angličtině je stupeň gramatikalizace kategorie rodu podstatně nižší a její vztah k mimojazykové skutečnosti podstatně bližší, než je tomu v češtině. Rod anglických substantiv odráží jednak rozdíly mezi pohlavím, jednak rozdíly mezi osobami a neosobami. V zásadě platí, že osoby mužského pohlaví jsou maskulina, osoby ženského pohlaví feminina a neživotné entity a zvířata neutra. Přechodové pásmo mezi osobami a neosobami tvoří vyšší druhy zvířat. K odchylkám od této základní klasifikace dochází vlivem faktorů stylistických nebo expresivních (emotivních).
Jelikož angličtina nerozlišuje různé deklinační typy ani nemá shodu v rodě u adjektiv a sloves podle řídícího substantiva, rod anglických substantiv se projevuje pouze v prostředcích odkazování. Proto se v angličtině mluví o rodu přirozeném, ba někdy se existence gramatické kategorie rodu u anglického substantiva zcela popírá. Nicméně prostředky odkazování jsou prostředky gramatické, takže rod anglických substantiv lze chápat jako kategorii sémanticko-gramatickou s nízkým stupněm gramatikalizace.
Rodové rozdíly a rozdíly v životnosti se u anglických substantiv uplatňují při užívání zájmen osobních, přivlastňovacích, zvratných, zdůrazňovacích a vztažných. Kromě zájmen vztažných se však projevují jen při odkazování na singulár, srov.:
<table>singulár plurál
<I>he</I>/<I>his</I>/<I>himself they</I>/<I>their(s)</I>/<I>themselves
son sons</I>
syn <I>who who</I>
<I>
daughter she</I>/<I>her(s)</I>/<I>herself daughters they</I>/<I>their(s)</I>/<I>themselves</I>
dcera <I>who who</I>
<I>
beetle beetles</I>
brouk  <I>it</I>/<I>its</I>/<I>itself they</I>/<I>their(s)</I>/<I>themselves
which which
pen pens</I>
pero</table>
Např. <I>Our HOST, WHO witnessed the scene, controlled HIMSELF admirably.</I> Náš hostitel, který byl svědkem té scény, se obdivuhodně ovládl. <I>MISS Adams always gives an excellent performance, but today SHE has surpassed HERSELF.</I> Slečna Adamsová vždycky podává výborný výkon, ale dnes sse překonala. <I>Although IT has been used by many eminent authors, the WORD has never established ITSELF in general use.</I> Ačkoliv toho slova (neutrum) užívalo mnoho význačných autorů, nikdy se v obecném úzu nevžilo. <I>A HYPOTHESIS remains tentaive until further observation either confirms or denies ITS validity.</I> Hypotéza (fem.) zůstává pokusnou, dokud další pozorování nepotvrdí nebo nevyvrátí její platnost. <I>THE ALARM-CLOCK winds up ITSELF. IT’s an automatic one. Budík (mask.) se natahuje sám, je automatický.</I>
Z hlediska rozlišení mužského a ženského rodu se anglická substantiva dělí na několik skupin.'$
'3.41','Substantiva, označující osoby, které se liší pouze pohlavím, jsou často různé lexikální jednotky. Podobně je tomu i v češtině, srov. <I>man</I> muž – <I>woman</I> žena, <I>boy</I> chlapec – <I>girl</I> dívka, <I>lad</I> mládenec, mladík – <I>lass</I> dívka, <I>bachelor</I> svobodný muž – <I>spinster</I> (úředně) neprovdaná žena, <I>old maid</I> stará panna, <I>father</I> otec – <I>mother</I> matka, <I>brother</I> bratr – <I>sister</I> sestra, <I>uncle</I> strýc – <I>aunt</I> teta, <I>nephew</I> synovec – <I>niece</I> neteř, <I>husband</I> manžel – <I>wife</I> manželka, <I>king</I> král – <I>queen</I> královna, <I>gentleman</I> pán – <I>lady</I> dáma, <I>sir</I> pane – <I>madam</I> paní, slečno (oslovení), <I>monk</I> mnich – <I>nun</I> jeptiška aj. Substantiva, označující osoby, které se – liší pouze pohlavím, jsou často různé lexikální jednotky. S podobným rozlišením se setkáváme i u některých zvířat (někdy existuje též označení zahrnující obě pohlaví nebo jedno z označení zahrnuje kromě příslušného pohlaví i celý druh), např. <I>stallion</I> hřebec – <I>mare</I> klisna (<I>horse</I> kůň), <I>colt</I> mladý hřebec – <I>filly</I> mladá klisa (<I>foal</I>), <I>cock</I> (amer. <I>rooster</I>) kohout – <I>hen</I> slepice, <I>bull</I> býk – <I>cow</I> kráva, <I>dog</I> pes – <I>bitch</I> fena, <I>gander</I> houser – <I>goose</I> husa, <I>drake</I> kačer – <I>duck</I> kachna, <I>fox</I> lišák – <I>vixen</I> liška, <I>hart</I>/<I>stag</I> jelen – <I>hind</I> laň (<I>deer</I>) aj.
<note id="3.41/P34">
Některá označení osob nemají protějšek označující druhé pohlaví, např. <I>fop</I> švihák, hejsek, <I>dandy</I>, <I>dude</I> (amer.) švihák, elegán, <I>minx</I> drzá poťouchlice, <I>hussy</I> nevychované děvče. V současném jazyce sem patří i <I>witch</I> čarodějnice, neboť <I>wizard</I> (čaroděj, kouzelník) se dnes užívá hlavně ve významu „osoba s úžasnými schopnostmi“, např. <I>a financial wizard</I> finanční génius.
</note>'$
'3.42','Substantiva obou rodů mají společný základ a liší se buď sufixem (přechylování), nebo u kompozit složkou označující příslušné pohlaví.
Na rozdíl od češtiny je přechylování v angličtině dost řídké. Nejběžnější je přechylovací sufix feminin <I>-ess</I>, často provázený změnami v kmeni, např. <I>actor</I> herec – <I>actress</I> herečka, <I>adventurer</I> dobrodruh – <I>adventuress</I> dobrodružka, <I>benefactor</I> dobrodinec – <I>benefactress</I> dobrodinka, <I>count</I> hrabě – <I>countess</I> hraběnka, <I>duke</I> vévoda – <I>duchess</I> vévodkyně, <I>emperor</I> císař – <I>empress</I> císařovna, <I>god</I> bůh – <I>goddess</I> bohyně, <I>heir</I> dědic – <I>heiress</I> dědička, <I>host</I> hostitel – <I>hostess</I> hostitelka, <I>master</I> pán – <I>mistress</I> paní, <I>prophet</I> věštec – <I>prophetess</I> věštkyně, <I>proprietor</I> majitel (např. hotelu) – <I>proprietress</I> majitelka, <I>shepherd</I> pastýř – <I>shepherdess</I> pastýřka, <I>steward</I> steward – <I>stewardess</I> stewardka, <I>tiger</I> tygr – <I>tigress</I> tygřice, <I>traitor</I> zrádce – <I>traitress</I> zrádkyně, <I>waiter</I> číšník – <I>waitress</I> číšnice aj.
Řidčeji se vyskytují jiné přechylovací sufixy, např. <I>hero</I> hrdina – <I>heroine</I> hrdinka, <I>usher</I> uvaděč (v biografu apod.) – <I>usherette</I> uvaděčka, <I>widow</I> vdova – <I>widower</I> vdovec, <I>bride</I> nevěsta – <I>bridegroom</I> ženich (u posledních dvou párů je odvozený člen maskulinum).
Specificky anglický prostředek rozlišování rodu je užívání kompozit, jejichž jednu složku tvoří <I>man</I>/<I>woman</I>, <I>gentlemena</I>/<I>lady</I>, <I>boy</I>/<I>girl</I>, <I>male</I>/<I>female</I> nebo jiné označení rodu, např. <I>men teachers</I> učitelé – <I>women teachers</I> učitelky, <I>boy students</I> studenti – <I>girl students</I> studentky, <I>sportsman</I> sportovec – <I>sportswoman</I> sportovkyně, <I>laundryman</I> zaměstnanec prádelny – <I>laundrywoman</I> pradlena, zaměstnankyně prádelny, <I>male readers</I> čtenáři – <I>female readers</I> čtenářky, <I>man-servant</I> sluha – <I>maid-servant</I> služebná, <I>tom-cat</I> kocour – <I>pussy-cat</I> kočka, <I>turkey-cock</I> krocan – <I>turkey-hen</I> krůta, <I>he-goat</I> kotel – <I>she-goat</I> koza aj. (plurál těchto kompozit viz 3.11.26).'$
'3.43','Četná substantiva mohou označovat oba rody (mužský i ženský, tzv. dual gender). Tento případ je v češtině výjimkou, např. <I>host</I> stejně jako <I>guest</I> může být osoba mužského i ženského rodu. Srovnej <I>assistant</I> asistent(ka), <I>author</I> autor(ka), <I>artist</I> umělec, umělkyně, <I>cook</I> kuchař(ka), <I>cousin</I> bratranec, sestřenice, <I>crony</I> blízký přítel, blízká přítelkyně, <I>doctor</I> doktor(ka), <I>editor</I> redaktor(ka), <I>foreigner</I> cizinec, cizinka, <I>friend</I> přítel(kyně), <I>guest</I> host, <I>inhabitant</I> obyvatel(ka), <I>librarian</I> knihovník, knihovnice, <I>member</I> člen(ka), <I>musician</I> hudebník, hudebnice, <I>neighbour</I> soused(ka), <I>nurse</I> ošetřovatel(ka), <I>parent</I> rodič, <I>person</I> osoba, <I>pupil</I> žák(yně), <I>reader</I> čtenář(ka), <I>servant</I> sluha, služebná, <I>speaker</I> mluvčí, <I>stranger</I> neznámá osoba, <I>teacher</I> učitel(ka), <I>writer</I> spisovatel(ka) a mnoho dalších. Např. <I>my neighbour Mr. Bond</I> můj soused pan Bond – <I>my neighbour Miss Bond</I> moje sousedka slečna Bondová, <I>our guest took his leave</I> náš host (mužského rodu) se rozloučil – <I>our guest took her leave</I> náš host (ženského rodu) se rozloučil, <I>Professor Baker and his wife</I> profesor Baker a jeho manželka – <I>Professor Baker and her assistant</I> profesorka Bakerová a její asistent(ka).
Je-li třeba u této skupiny vyjádřit rod explicitně, užívá se způsobu uvedeného v 3.42, např. <I>lady doctor</I> doktorka.
Na některá substantiva (hlavně mláďata) lze odkazovat zájmeny všech tří rodů. Tak v případě <I>baby</I> (malé) dítě, <I>child</I> dítě při odkazování na určité dítě, k němuž má mluvčí vztah, se užívá <I>he</I> nebo <I>she</I> podle pohlaví, např. <I>That child will be sick if he eats any more</I>/<I>if she eats any more.</I> Tomu dítěti bude špatně, bude-li (on/ona) ještě něco jíst. Pokud pohlaví dítěte není známo nebo na něm nezáleží, užívá se <I>it</I>: <I>Every child reacts in its own way.</I> Každé dítě reaguje svým způsobem (po svém). V odborném jazyce se ve funkci bezrodého zájmena v tomto případě užívá <I>he</I>, např. <I>A child’s acquisition of his mother tongue is by no means an automatic process.</I> (Christophersen 56) Osvojování mateřštiny u dítěte nikterak není automatický proces.
<note id="3.43/P35">
Kolektiva se konstruují buď jako neživotný singulár <I>it</I> nebo jako životný plurál <I>they</I> (viz 3.12.1).
</note>'$
'3.44','Na zvířata se většinou odkazuje pomocí it, např. <I>The cat flung itself across the yard.</I> (Adams 213) Kočka se vrhla přes dvůr. <I>The fish produced every trick to detach itself from its tormentor.</I> Ryba dělala všechno možné, aby se odpoutala od svého trapiče. <I>A bird which has been wounded is only too likely to find itself deserted.</I> Pták, který byl poraněn, s velkou pravděpodobností zůstane opuštěn (ponechán svému osudu). Tento úzus je příznačný zejména pro odborné texty. S odkazováním na vyšší živočichy podle pohlaví se setkáváme u domácích zvířat, která jsou člověku společníkem nebo která chová pro nějaký užitek, a u lovných zvířat (zde u žívání <I>he</I>/<I>she</I> není nutně reflex pohlaví, např. rybáři mluví o velkých rybách jako o <I>he</I>, o velrybách jako o <I>she</I> apod.). Avšak i v tomto případě se užívá relativa <I>which</I>.'$
'3.45 Rod neurčitých zájmen','Sepětí anglických odkazovacích prostředků s přirozeným rodem (s rozdíly v pohlaví) působí obtíže při odkazování na výrazy, které jsou rodově neutrální: <I>everyone</I>, <I>everybody</I> každý, <I>each</I> každý, <I>anyone</I>, <I>anybody</I> kdokoliv, <I>somebody</I>, <I>someone</I> někdo, <I>nobody</I>, <I>no one</I> nikdo, <I>person</I> osoba apod. V běžně mluveném jazyce (zejména v britské angličtině) se v tomto případě užívá plurálových odkazovacích prostředků, např. <I>Everyone has their faults.</I> Každý má (své) chyby. <I>If anyone calls ask for their number so that I can ring them back.</I> Bude-li někdo volat, požádejte ho o číslo, abych mu mohl zavolat. <I>Nobody was hurt, were they?</I> Nikdo nebyl zraněn, že ne?
Tento úzus sice řeší problém rodu, avšak vede k neshodě v čísle, neboť <I>everyone</I>, <I>everybody</I>, <I>anyone</I> atd. jsou singuláry (pojí se vždy jen se singulárovým tvarem slovesa), kdežto odkazovací výrazy jsou plurálové. Proto se alespoň pro formální projevy doporučuje užívat jako bezrodého zájmena <I>he</I> (<I>his, him, himself</I>). Např. <I>Everyone wants to realize his ambition.</I> Každý chce uskutečnit své ambice. <I>Does the person’s perception of the importance of the examination affect his performance?</I> (Mackay 16) Ovlivňuje to, že si je zkoušený vědom důležitosti zkoušky, jeho výkon?
Třetí způsob odkazování na neurčité výrazy je disjunktivní spojení <I>he or she</I>, <I>his or her</I> atd., pro běžný úzus pedantské a zdlouhavé, avšak nutné např. v jazyce právním. <I>Anyone naturally hesitates to say what he or she thinks on such occasions.</I> Každý přirozeně váhá říci, co si při takových příležitostech myslí. <I>Science is becoming so vast that every scientist is inevitably a specialist, and his or her judgment is not to be trusted outside a narrow field.</I> (Haldane 167) Věda se stává tak rozsáhlou, že každý vědec je nevyhnutelně specialista a mimo jeho úzký obor nelze jeho úsudku důvěřovat.'$
'3.46 Personifikace neživotných entit','Personifikace neživotných entit se vyskytuje jednak v jazyce běžně mluveném, v němž mluvčí tímto způsobem vyjadřuje svůj osobní vztah k příslušnému předmětu, jednak v jazyce krásné literatury, kde jde většinou o personifikaci rázu tradičního.
Běžně se personifikují např. lodi (<I>she</I>): <I>A fishing vessel was unloading her cargo.</I> Nějaká rybářská loď vykládala svůj úlovek. Dále auta a stroje (<I>she</I>), např. <I>There she is! The most luxurious car ever made!</I> Tady přijíždí! Nejluxusnější auto, jaké kdy bylo vyrobeno! <I>Off she goes! From now on for the next hour the machine will be multiplying a hundred thousand ten-figure numbers every minute.</I> (Hoyle 39) Už spustil! Od této chvíle po celou hodinu stroj za každou minutu vynásobí sto tisíc desetimístných čísel.
Často se též odkazuje zájmeny <I>she</I>, <I>her</I> atd. na jména zemí a měst (zejména v jazyce žurnalistickém), např. <I>Though she had not suffered wartime destruction, the United States shared with Europe an acute housing shortage.</I> (Jones 290) Ačkoliv Spojené státy neutrpěly válečným ničením, sdílely s Evropou naléhavý nedostatek bytů. <I>Southampton has a double tide, which makes her unique among British ports.</I> Southampton má dvojí příliv, což ho činí mezi britskými přístavy unikátním.
Jiného druhu je personifikace v krásné literatuře, která slouží jako stylistický prostředek vyššího, zejména poetického stylu. Personifikace bývá často podle latiny, např. <I>sun</I> slunce je maskulinum (<I>sol</I>), <I>moon</I> měsíc femininum (<I>luna</I>), <I>earth</I> země femininum (<I>terra</I>) apod. Při ženské personifikaci též spolupůsobí představa příjemných, dobrých vlastností (<I>spring</I> jaro, <I>nature</I> příroda, <I>virtues</I> ctnosti, <I>arts</I> umění, <I>liberty</I> svoboda, <I>charity</I> dobročinnost, <I>victory</I> vítězství, <I>mercy</I> milosrdenství apod.), při mužské vlastností záporných (<I>vices</I> neřesti, <I>death</I> smrt, <I>anger</I> hněv, <I>despair</I> zoufalství, <I>war</I> válka, <I>murder</I> vražda, <I>law</I> zákon apod). Vliv latiny a tato tendence někdy působí proti sobě, srov. <I>love</I> láska je maskulinum (podle <I>amor</I>). Maskulina jsou též <I>mountains</I> hory, <I>rivers</I> řeky (<I>old man river</I>), <I>time</I> čas aj. Někdy se personifikuje oběma rody (<I>sea</I> moře <I>he</I>/<I>she</I>, <I>world</I> svět <I>he</I>/<I>she</I>). Např. <I>The sun was finishing his day.</I> Slunce končilo svůj den. <I>It was like the lull before an earthquake when all nature holds her breath in terrified anticipation of the violence to come.</I> Bylo to jako klid před zemětřesením, kdy celá příroda zadržuje dech v hrůzyplném očekávání spouště, která nastane. <I>Life has dealt him his cruellest blow.</I> Život mu zasadil svou nejkrutější ránu. <I>All the world and his wife were there.</I> Byly tam všechny významné (známé) osobnosti.'$
'3.5 Pád','Gramatická kategorie pádu je v jazycích jako čeština reprezentována substantivní flexí. Jednotlivé členy pádového paradigmatu vyjadřují různé syntaktické vztahy vzhledem k predikativnímu slovesu (nominativ je pád podmětu, akuzativ přímého předmětu apod.) nebo vzájemné vztahy mezi větnými členy realizovanými substantivy (např. <I>střecha domu</I>, <I>zasažení bleskem</I> apod.)
Vedle tohoto pojetí pádu, vycházejícího z formálních paradigmatických obměn substantiva ve flektivních jazycích, se nověji objevilo pojetí sémantické, v němž se pády chápou jakou hloubkové syntaktické vztahy, které mohou být realizovány nejen flexí, nýbrž i předložkami a slovosledem. V tomto pojetí, známém jako pádová gramatika, se o pádech pojednává jako o sémantických rolích jmen; jednotlivé pády vyjadřují pojmy jako agentiv, objektiv, instrument, zdroj apod., tj. sémantické role substantivních větných členů (viz 13.14 a 13.31.1).'$
'3.51','Ve srovnání s rozvinutou flexí českého substantiva je anglický pádový systém chudý. Skládá se pouze z dvou tvarů, obecného, např. <I>pupil</I> žák, a tvaru homofonního s tvarem plurálu, tj. sykavkového zakončení s třemu výslovnostními alomorfy [s], [z], [ɪz], odlišeného v pravopise pomocí apostrofu: <I>pupil’s</I>, např. <I>the pupil’s answer</I> odpověď žáka, žákova odpověď. Tento tvar byl původně genitiv, avšak v současném jazyce si uchoval jen některé z genitivních funkcí. Neplní již funkci slovesného předmětu (na rozdíl od češtiny a staré angličtiny, srov. např. <I>vzdát se nároku</I>), ani funkci partitivní (<I>napít se čaje</I>). Může pouze determinovat nebo modifikovat substantivum, a proto vhodnější název než genitiv je adnominální pád. Adnominální pád bývá často označován jako posesivní forma, neboť má především funkci, která ho spojuje s posesivními zájmeny, srov. <I>Bill’s responsibility</I> Billova odpovědnost – <I>his responsibility</I> jeho odpovědnost. Posesivitou se však funkce adnominálního pádu nevyčerpávají (viz 3.51.5).
Proti obecnému pádu u substantiv rozlišují osobní zájmena a <I>who</I> tvary dva, podmětový (<I>I</I>, <I>he</I>, atd., <I>who</I>) a předmětový (<I>me</I> , <I>him</I>, atd., <I>whom</I>, viz 4.1, 4.5, 4.6).
Na druhé straně však přivlastňovací tvary <I>my</I>, <I>his</I> atd. součást zájmenného pádového paradigmatu netvoří, takže pádový systém zájem je také jen dvojčlenný. Členy dvojčlenného substantivního a dvojčlenného zájmenného systému se však liší.'$
'3.51.1','Adnominální pád se klade před substantivum, čímž se liší od genitivu s <I>of</I>, srov. <I>the earth’s origin</I> – <I>the origin of the earth</I> vznik země. Má tedy vzhledem k řídícímu substantivu stejné postavení jako modifikující adjektivum. S adjektivem má též společnou funkci přívlastku v případě, že je vyjádřen generickým substantivem, např. <I>A girl’s interests are rarely fixed.</I> Dívčí zájmy jsou zřídka ustálené (srov. druhové adjektivum v češtině). Je-li adnominální pád vyjádřen negenerickým substantivem, má funkci determinátoru, srov. <I>his wife’s relations</I> – <I>the relations of his wife</I> příbuzní jeho ženy.
<note id="3.51.1/P36">
Generický a negenerický adnominální pád se často liší přízvukem. Adnominální pád v generické funkci má tendenci stát se nositelem hlavního přízvuku celého sousloví, srov. <I>a ˈdoctor’s deˌgree</I> hodnost doktora, kdežto v sousloví s negenerickýkm adnominálním pádem mají obě substantiva stejně silný přízvuk: <I>my ˈmother’s ˈring</I> prsten mé matky. Proto spojení jako <I>a girl’s voice</I> bývá dvojznačné jen v psaném jazyce. Ve významu „dívčí hlas“ se uplatňuje prvá přízvuková struktura, ve významu „hlas nějaké dívky“ druhá.
</note>
Z funkčního hlediska tedy vyvstává otázka, máme-li co činit se substantivem. Pro substantivní chápání adnominálního pádu svědčí tyto rysy:
(a) Adnominální pád rozlišuje alespoň u některých substantiv tvar singuláru a plurálu, srov. <I>our child’s progress at school</I> pokrok našeho dítěte ve škole – <I>our</I> <I>children’s progress at school</I> pokrok našich dětí ve škole.
(b) Může být modifikován adjektivem (zatímco adjektivum se modifikuje nebo intenzifikuje adverbiem), např. <I>a young girl’s ideals</I> ideály mladé dívky. Adjektivum před spojením substantiva s adnominálním pádem může ovšem patřit i k řídícímu substantivu, srov. <I>a red doll’s cap</I> červená čepička pro panenku (<I>a red cap for a doll</I>).
(c) Determinátor u sousloví adnominálního pádu a řídícího substantiva patří většinou k adnominálnímu pádu. Tak je tomu vždy, má-li adnominální pád funkci determinátoru, např. <I>One man’s gain means another man’s loss.</I> Zisk jednoho člověka znamená pro jiného ztrátu. Jak ukazuje genitiv s <I>of</I> (<I>the gain of one man, the loss of another man</I>) patří <I>one</I> a <I>another</I> k <I>man’s.</I> Vazba s<I> of</I> rovněž demonstruje náhradu determinátoru řídícího substantiva <I>the gain</I>/<I>loss</I> adnominálním pádem. Podobně v případě <I>John’s choice</I> (Janova volba, volba Jana) jde o bezčlennost vlastního jména realizující adnominální pád, srov. <I>the choice of John.</I>
